"vice, journalism, documentary, videos, culture, interview, film, movies, underground, vice videos, lifestyle, independent, vice guide, exclusive, vice mag, vice magazine, vice.com, world, documentaries, short films, docs, yt:cc=on, Witness, migracam, mexico, Brownsville, Texas, ACLU, iphone, android, know your rights, livestream, live stream, safety, public safety, filming police, ICE, border patrol, wall, marta martinez, michael brown, copwatch, donald trump, trayvon martin, migrant caravan",Vice,Fri Apr 12 2019 00:00:00 GMT-0600 (Mountain Daylight Time),The Watchdogs Surveilling Border Patrol and ICE,1352,1672,736,84021,k_ILl04HBME,,71.4042175
"humor, funny, Yelp, one star reviews, worst reviews, vice, journalism, documentary, videos, culture, interview, film, movies, underground, vice videos, lifestyle, independent, vice guide, exclusive, vice mag, vice magazine, vice.com, world, documentaries, short films, docs, yt:cc=on, plastic surgery, botox, filler, i got botox, youth, appearance, beauty, taji ameen, face, facial, i got work, worst-rated, vice guide to right now, taji one star, one star review, comedy, review",Vice,Thu Apr 11 2019 00:00:00 GMT-0600 (Mountain Daylight Time),One of Yelp’s Worst-Rated Plastic Surgeons: I Got Work Done | One Star Reviews,21641,1680,640,1126953,w8OrhHj8pOA,,81.37909119
"documentary, documentaries, docs, interview, culture, lifestyle, world, exclusive, independent, underground, videos, journalism, vice guide, vice.com, vice, vice magazine, vice mag, vice videos, film, short films, movies, homeless, homelessness, sleeping rough, poverty, london, horror, director, filmmaking, filmmaker, United Kingdom, britain, brexit, action, spy, thriller, mystic demon killer, homeless film director, cult films, outsider",Vice,Wed Apr 10 2019 00:00:00 GMT-0600 (Mountain Daylight Time),The Homeless Man Who Made a Horror Movie,3379,79,1788,118353,P-aV9cOiSBE,,79.68546169
"New York, BROOKLYN, art, Tattoos, health, cancer, Tonic, Breast cancer, sue jeiven, vice, journalism, documentary, videos, culture, interview, film, movies, underground, vice videos, lifestyle, independent, vice guide, exclusive, vice mag, vice magazine, vice.com, world, documentaries, short films, docs, yt:cc=on, tattoo art, tattoo, illustration, drawing, stage 4 cancer, stage iv cancer, new york city, legacy, immortality, east river tattoo, tattoo stories",Vice,Tue Apr 09 2019 00:00:00 GMT-0600 (Mountain Daylight Time),How Terminal Cancer Changed Me as a Tattoo Artist | Immortalized in Ink,1626,80,246,51481,-eTBHwEjNP8,,65.75561699
"vice, money, NEW YORK CITY, san francisco, rent, The VICE Guide To Right Now, journalism, documentary, videos, culture, interview, film, movies, underground, vice videos, lifestyle, independent, vice guide, exclusive, vice mag, vice magazine, vice.com, world, documentaries, short films, docs, yt:cc=on, finance, economy, lee adams, explainer, explained, universal rent control, new york city, high rent, paycheck, millennial, loans, mortgage, michael rotondo, 30 year old evicted, living at home",Vice,Sun Apr 07 2019 00:00:00 GMT-0600 (Mountain Daylight Time),Why Your Rent is So Damn High,7113,1360,360,226656,A5xKz5AcuXE,,82.41941823
"documentary, documentaries, docs, interview, culture, lifestyle, world, exclusive, independent, underground, videos, journalism, vice guide, vice.com, vice, vice magazine, vice mag, vice videos, film, short films, movies, wrestling, bruiser brody, wwe, wwf, fighting, bloody fights, scariest wrestlers, terrifying stories, death, murder, true crime, kayfabe, invader #1, bruiser brody son, Frank Donald Goodish, Puerto Rico, abdullah the butcher, jose gonzalez, wwwf, brawling, dutch mantell, stabbing, knife",Vice,Sat Apr 06 2019 00:00:00 GMT-0600 (Mountain Daylight Time),The Life and Death of Legendary Wrestler Bruiser Brody | DARK SIDE OF THE RING (Full Episode),4926,59,2666,140103,inXF6i3TvvU,,91.16016963
"vice, documentary, war, syria, Sweden, isis, Caliphate, YPG, foreign, fighter, ISIS stronghold, diary, ANTI-JIHADIST MILITIA, SWEDISH KURDISH FIGHTER, FOREIGN FIGHTER, COMBAT MEDIC, FIGHTING ISIS, journalism, videos, culture, interview, film, movies, underground, vice videos, lifestyle, independent, vice guide, exclusive, vice mag, vice magazine, vice.com, world, documentaries, short films, docs, yt:cc=on, firat, vice news, journalist, soldier, warrior, battle",Vice,Fri Apr 05 2019 00:00:00 GMT-0600 (Mountain Daylight Time),Safer at War than at Home | Diary of a Combat Medic (Part 3/3),5627,229,269,187916,m54L1jusS5w,,74.21669071
"vice, documentary, war, syria, Sweden, isis, Caliphate, YPG, foreign, fighter, ISIS stronghold, diary, ANTI-JIHADIST MILITIA, SWEDISH KURDISH FIGHTER, FOREIGN FIGHTER, COMBAT MEDIC, FIGHTING ISIS, journalism, videos, culture, interview, film, movies, underground, vice videos, lifestyle, independent, vice guide, exclusive, vice mag, vice magazine, vice.com, world, documentaries, short films, docs, yt:cc=on, middle east, iraq, iran",Vice,Thu Apr 04 2019 00:00:00 GMT-0600 (Mountain Daylight Time),Interrogating Enemy Fighters | Diary of a Combat Medic (Part 2/3),4368,113,255,156918,_xO5dsGEL_E,,73.28872899
"documentary, documentaries, docs, interview, culture, lifestyle, world, exclusive, independent, underground, videos, journalism, vice guide, vice.com, vice, vice magazine, vice mag, vice videos, film, short films, movies, kurds, kurdish, war, islamic, muslim, syria, people's defense unit, ypg, sdf, syrian democratic force, vice news, news, isis, caliphate, defending syria, united states, sweden, packing for war, preparing for war, isil, military, anti-jihadist, militia, battle",Vice,Wed Apr 03 2019 00:00:00 GMT-0600 (Mountain Daylight Time),What to Pack for War in Syria | Diary of a Combat Medic (Part 1/3),7976,214,383,253701,PdJJxwP8NaU,,76.78987761
"tom scott, tomscott, cape reinga, tasman sea, pacific ocean, new zealand, where two oceans meet, things you might not know",Tom Scott,Mon Apr 15 2019 00:00:00 GMT-0600 (Mountain Daylight Time),"Where Two Oceans Meet, Debunked",10093,55,177,71036,a4N4yQB_B4c,,67.77598847
"tom scott, tomscott, vancouver, need for speed ii, deja vu",Tom Scott,Mon Apr 08 2019 00:00:00 GMT-0600 (Mountain Daylight Time),I Drove My Childhood Favorite Racing Game In Real Life,32788,188,224,382058,juRkaqkDfCM,,85.49724615
"tom scott, tomscott, built for science, multi-axes rotation and tilt device, brandeis university, ashton graybiel spatial orientation laboratory, disorientation, artificial gravity",Tom Scott,Tue Apr 02 2019 00:00:00 GMT-0600 (Mountain Daylight Time),The Artificial Gravity Lab,36154,166,378,591078,bJ_seXo-Enc,,86.20569427
"tom scott, tomscott, built for science, multi-axes rotation and tilt device, brandeis university, ashton graybiel spatial orientation laboratory, disorientation, vestibular system",Tom Scott,Mon Mar 25 2019 00:00:00 GMT-0600 (Mountain Daylight Time),Blindfold Balancing in the Spinning Space Chair,14084,70,300,244923,jhQa9xLk5qk,,74.96829473
"tom scott, tomscott, built for science, harvard art museums, forbes pigment collection, Narayan Khandekar, straus center",Tom Scott,Mon Mar 18 2019 00:00:00 GMT-0600 (Mountain Daylight Time),The Library of Rare Colors,23204,122,313,457756,rApTzWboLrA,,69.58961008
"tom scott, tomscott, game garage, keep it or dump it, quiz show, quiz",Tom Scott,Thu Mar 14 2019 00:00:00 GMT-0600 (Mountain Daylight Time),"Keep It or Dump It (with Matthew, who is lovely but not internet famous)",10357,99,892,180392,6lTrkC8LFMc,,68.45498352
"tom scott, tomscott, fascination, fascination parlor, play-for-cash, cash, hull, nantasket beach, amazing places",Tom Scott,Mon Mar 11 2019 00:00:00 GMT-0600 (Mountain Daylight Time),The Last Play-For-Cash Fascination Parlor,16088,59,300,341444,bOWse-Xm6Ao,,81.51735704
"tom scott, tomscott, game garage, game show, barry lewis, colin furze, em ford, hannah witton, lucy belle earl, saf, steven bridges",Tom Scott,Thu Mar 07 2019 00:00:00 GMT-0700 (Mountain Standard Time),Above Average (with too many people to fit in this title),11485,216,1472,268503,RAgbu7eDm44,,69.2369184
"tom scott, tomscott, amazing places, st peter's seminary, glasgow, cardross, archdiocese of glasgow, scotland, seminary, modernist, brutalist, architecture",Tom Scott,Mon Mar 04 2019 00:00:00 GMT-0700 (Mountain Standard Time),The Broken Building That Must Not Be Destroyed,26337,352,299,698040,AtkmDmMzZO8,,85.74110499
"tom scott, tomscott, game garage, evan edinger, luke cutforth, quiz, weight for it",Tom Scott,Thu Feb 28 2019 00:00:00 GMT-0700 (Mountain Standard Time),Weight For It (with Evan Edinger and Luke Cutforth),12767,152,1250,202509,WnxVOw1uhTw,,70.06664087
"meme, shitpost, csgo, slav, door stuck, thom yorke, cum, 1886, gang banging with a diaper, 420, aids",1886,Sun Apr 21 2019 00:00:00 GMT-0600 (Mountain Daylight Time),yeah,689,2,31,3363,g8MUBBfP8mk,,35.14659919
"meme, shitpost, xxx, xxxtentacion, horny nigga laundry detergent, meat, 1886",1886,Tue Apr 16 2019 00:00:00 GMT-0600 (Mountain Daylight Time),horny nigga laundry detergent,2290,32,15,21312,Q0ctybN_JlE,,43.1381351
"meme, shitpost, edit, /mu/, 4chan, i only said, my bloody Valentine, loveless, 1886",1886,Thu Apr 11 2019 00:00:00 GMT-0600 (Mountain Daylight Time),wot if ye mum ran on battries,2174,20,82,20945,GUZBdOygQR8,,43.06295479
"meme, shitpost, 4chan, /mu/, neutral milk hotel, modern art, holland 1945, 1886",1886,Tue Apr 09 2019 00:00:00 GMT-0600 (Mountain Daylight Time),21234,2067,16,15,19395,Vl07iNvN9g0,,42.73019147
"meme, shitpost, cursed, cursed image, 1886, link, ocarina of Time, Sleepdealer, lofi",1886,Mon Apr 08 2019 00:00:00 GMT-0600 (Mountain Daylight Time),Cursed Images 7,2110,13,107,22362,n6NlnD05ByI,,43.34628481
"meme, shitpost, audioslave, chris cornell, SpongeBob, crunk, what you are, 1886",1886,Thu Mar 14 2019 00:00:00 GMT-0600 (Mountain Daylight Time),what you are,4107,59,11,57978,V_ymhgjm830,,47.46965384
"meme, shitpost, cursed, scp, 1886, bliss, jinsang, life, lofi, lofi hip hop, lofi beats to relax and study to, creepypasta",1886,Sat Mar 02 2019 00:00:00 GMT-0700 (Mountain Standard Time),bliss,12024,253,25,310709,7vm_y72rCTk,,54.73561352
"meme, shitpost, shrimp, Minecraft, cat, russian, 1886",1886,Sun Feb 24 2019 00:00:00 GMT-0700 (Mountain Standard Time),cat,5994,25,10,84421,_7ZET0HxeJ8,,49.09594289
"meme, shitpost, neutral milk hotel, 1886, marching theme, /mu/, 4chan, greentext, shit",1886,Sat Feb 09 2019 00:00:00 GMT-0700 (Mountain Standard Time),born to shit forced to wipe,5562,40,32,75096,tjGqSuFYnYo,,48.58934533
"meme, 1886, neutral milk hotel, holland 1945, in an aeroplane over the sea, shitpost, edit",1886,Thu Jan 10 2019 00:00:00 GMT-0700 (Mountain Standard Time),Holland 1945,17322,272,106,223720,1-nkbipHEdk,,53.31400413
"UC4YaOt1yT-ZeyB0OmxHgolA, キズナアイ, KizunaAI, A.I.Channel, アイチャンネル, A.I.Games, アイゲームス, バーチャルYouTuber, YouTuber, AI, kizuna, アニメ, anime, kawaii, バーチャルユーチューバー, vtuber, モーニングコール",A.I Channel,Sat Apr 20 2019 00:00:00 GMT-0600 (Mountain Daylight Time),モーニングコール from キズナアイ,12517,83,134,157974,q25WRWP_xcU,,71.56287033
"UC4YaOt1yT-ZeyB0OmxHgolA, キズナアイ, KizunaAI, A.I.Channel, アイチャンネル, A.I.Games, アイゲームス, バーチャルYouTuber, YouTuber, AI, kizuna, アニメ, anime, kawaii, バーチャルユーチューバー, vtuber, 料理, みーちゃん",A.I Channel,Sat Apr 20 2019 00:00:00 GMT-0600 (Mountain Daylight Time),【料理】知らない料理作ってみたらカオスすぎたwww,5328,94,449,112309,7txO0Xf1b4Q,,68.33134206
"UC4YaOt1yT-ZeyB0OmxHgolA, キズナアイ, KizunaAI, A.I.Channel, アイチャンネル, A.I.Games, アイゲームス, バーチャルYouTuber, YouTuber, AI, kizuna, アニメ, anime, kawaii, バーチャルユーチューバー, vtuber, 断捨離, アプリ",A.I Channel,Fri Apr 19 2019 00:00:00 GMT-0600 (Mountain Daylight Time),【断捨離】いらないものは捨てようね・・？,3959,47,459,96710,kGdEhg0taww,,62.4279149
"UC4YaOt1yT-ZeyB0OmxHgolA, キズナアイ, KizunaAI, A.I.Channel, アイチャンネル, A.I.Games, アイゲームス, バーチャルYouTuber, YouTuber, AI, kizuna, アニメ, anime, kawaii, バーチャルユーチューバー, vtuber, 大激怒, 激怒, 怒る, 10回クイズ, 美少女, クイズ, 퀴즈",A.I Channel,Tue Apr 16 2019 00:00:00 GMT-0600 (Mountain Daylight Time),【激怒】10回クイズゲームやったら美少女AIイライラ！！！,4576,103,205,88537,RiWl0PkoIHg,,71.89612299
"UC4YaOt1yT-ZeyB0OmxHgolA, キズナアイ, KizunaAI, A.I.Channel, アイチャンネル, A.I.Games, アイゲームス, バーチャルYouTuber, YouTuber, AI, kizuna, アニメ, anime, kawaii, バーチャルユーチューバー, vtuber, 占い, 夢, 夢占い",A.I Channel,Sun Apr 14 2019 00:00:00 GMT-0600 (Mountain Daylight Time),こんな夢見たことありませんか？,4249,82,224,110578,I9Ru2bP1Z_k,,71.46238214
"UC4YaOt1yT-ZeyB0OmxHgolA, キズナアイ, KizunaAI, A.I.Channel, アイチャンネル, A.I.Games, アイゲームス, バーチャルYouTuber, YouTuber, AI, kizuna, アニメ, anime, kawaii, バーチャルユーチューバー, vtuber, 英会話, DMM, 英語, English, 大事故, 영어",A.I Channel,Sat Apr 13 2019 00:00:00 GMT-0600 (Mountain Daylight Time),英語が話せるようになりたい！,5434,36,498,85487,cxQE-2T7cQo,,75.41491478
"UC4YaOt1yT-ZeyB0OmxHgolA, キズナアイ, KizunaAI, A.I.Channel, アイチャンネル, A.I.Games, アイゲームス, バーチャルYouTuber, YouTuber, AI, kizuna, kawaii, バーチャルユーチューバー, vtuber, アズレン, アズールレーン, 벽람항로, 수족관, 水族館, ロケ, azurlane, コラボ",A.I Channel,Fri Apr 12 2019 00:00:00 GMT-0600 (Mountain Daylight Time),はじめての水族館で重大告知！！！,5489,79,422,138398,OF-wWljpNq4,,75.38493636
"UC4YaOt1yT-ZeyB0OmxHgolA, キズナアイ, KizunaAI, A.I.Channel, アイチャンネル, A.I.Games, アイゲームス, バーチャルYouTuber, YouTuber, AI, kizuna, アニメ, anime, kawaii, バーチャルユーチューバー, vtuber, 패션",A.I Channel,Wed Apr 10 2019 00:00:00 GMT-0600 (Mountain Daylight Time),あんな服やこんな服を着てみました♡ 【着せ替えごっこ】[ENG SUB],4481,57,322,117217,wwI50slpxYw,,73.22603371
"UC4YaOt1yT-ZeyB0OmxHgolA, キズナアイ, KizunaAI, A.I.Channel, アイチャンネル, A.I.Games, アイゲームス, バーチャルYouTuber, YouTuber, AI, kizuna, アニメ, anime, kawaii, バーチャルユーチューバー, vtuber, Google, 入社試験, 天才, 구글, 입사시험, 시험",A.I Channel,Tue Apr 09 2019 00:00:00 GMT-0600 (Mountain Daylight Time),Googleの入社試験ガチで解いてみたら天才すぎた☆ [ENG SUB],5199,65,333,130095,-14_XMIvQ7E,,74.75982998
"robot chicken, adult swim, promo, video, comedy, short, parody, seth green, matthew senreich, road hawgs, pigs, bacon",Adult Swim,Sat Apr 20 2019 00:00:00 GMT-0600 (Mountain Daylight Time),Road Hawgs | Robot Chicken | adult swim,1287,45,91,31591,vFruy7nnxeM,,51.80746224
"your pretty face, your pretty face is going to hell, adult swim, video, comedy, gary, satan, henry zebrowski, devil, trailer, season 4, matt servitto, last podcast on the left, ypf, dave willis, casper kelly, raw power, the stooges, craig rowin, season 4 trailer, ypfigth, the devil, tv trailer, show trailer",Adult Swim,Fri Apr 19 2019 00:00:00 GMT-0600 (Mountain Daylight Time),Season 4 Trailer | Your Pretty Face Is Going To Hell | Adult Swim,871,16,31,17592,IbUTnyzjTBo,,61.43301396
"adult swim, video, comedy, funny, stream, streaming, smalls, succe$$, the office, office, parody, workplace, williams street, shorts, michael scott",Adult Swim,Mon Apr 15 2019 00:00:00 GMT-0600 (Mountain Daylight Time),"SUCCE$$ “The Office"" | adult swim smalls",1347,97,67,36972,lQp6VVnYCmc,,61.99799569
"adult swim, comedy, video, funny, animation, lazor wulf, strongburg, trademark, laser, wolf, premise, god, horse, king yeti, Esther’s, The Clurb, Musty’s, Blazor’s, clurb, cannon, vince staples, carl jones, big baby dram, dram, quinta brunson, jd witherspoon, big e, wwe, henry the worst, daniel weidenfeld, adult swim cartoon, no chill, bento box entertainment, adult swim shows",Adult Swim,Mon Apr 15 2019 00:00:00 GMT-0600 (Mountain Daylight Time),The Great Battle | Lazor Wulf | adult swim,624,55,124,19439,bGPOQVRZSn8,,45.73999915
"robot chicken, adult swim, promo, video, comedy, Seth Green, Matthew Senreich, parody, jessica jones, marvel, marvels jessica jones, marvels daredevil, krysten ritter, marvel comics, marvel universe, marvel cinematic universe, mcu, netflix, luke cage, the defenders, daredevil, punisher, elektra",Adult Swim,Sat Apr 13 2019 00:00:00 GMT-0600 (Mountain Daylight Time),Jessica Jones' Intervention | Robot Chicken | adult swim,8790,217,110,365682,-hjoNuy1M38,,74.56580856
"Jena Friedman, Soft Focus, adult swim, promo, video, comedy, vr, virtual reality, harassment, gaming, gamer, sexual harassment, comedy stand up, stand up, stand up comedian, vr games, virtual reality videos funny, virtual reality fails, harassment social experiment, late night, sexual, sex",Adult Swim,Wed Apr 10 2019 00:00:00 GMT-0600 (Mountain Daylight Time),Sexual Harassment in Gaming | Soft Focus with Jena Friedman 2 | adult swim,6618,2624,607,186411,ztqLcoaDlHc,,76.6081004
"adult swim, video, comedy, funny, stream, streaming, smalls, spooky dreams, zae jordan, javier williams, dream gurl",Adult Swim,Mon Apr 08 2019 00:00:00 GMT-0600 (Mountain Daylight Time),"Spooky Dreams “Dream Gurl"" | adult swim smalls",816,57,79,19066,Ppw6jy5cCws,,51.07820851
"adult swim, comedy, video, funny, animation, lazor wulf, strongburg, trademark, laser, wolf, premise, god, horse, king yeti, Esther’s, The Clurb, Musty’s, Blazor’s, clurb, cannon, vince staples, carl jones, big baby dram, dram, quinta brunson, jd witherspoon, big e, wwe, henry the worst, daniel weidenfeld, no chill",Adult Swim,Mon Apr 08 2019 00:00:00 GMT-0600 (Mountain Daylight Time),Nice Ass Moon | Lazor Wulf | adult swim,1221,69,98,31474,OeLFUBYyLAQ,,57.08800729
"robot chicken, adult swim, promo, video, comedy, Seth Green, Matthew Senreich, beavis and butthead, barack obama, obama, adult swim cartoon, adult swim robot chicken, adult swim shows, robot chicken full episodes",Adult Swim,Sat Apr 06 2019 00:00:00 GMT-0600 (Mountain Daylight Time),"Hello, Old Friend | Robot Chicken | adult swim",6261,84,124,152936,uBRUtSLuILw,,71.93236807
"fishcenter, fishcenter live, adult swim, funny, comedy, music, video, music video, streams, live, live performance, T Hardy Morris, Homemade Bliss",Adult Swim,Tue Apr 02 2019 00:00:00 GMT-0600 (Mountain Daylight Time),"T. Hardy Morris ""Homemade Bliss"" | FishCenter | Adult Swim",292,15,228,9321,GD0j7vFp7cY,,55.52459137
"eggman, big man tyrone",Big Man Tyrone,Sun Apr 21 2019 00:00:00 GMT-0600 (Mountain Daylight Time),A Serious Message To Eggman,245,2,72,1532,BhgGquDzP18,,31.74360175
"kekistan, kekistani, proud kekistani, professional videos, birthday videos, video jokes, Big Tyrone, personal video, corporate video, video production, product video marketing, video, marketing videos, product marketing, rapid growth coach, pepe, shadilay, Big Man Tyrone, sargon of akkad, trump, pol, cosplay, anime, meme, memes, frog, dank meme compilation, try not to laugh, tyrone, dank, congratulations",Big Man Tyrone,Thu Apr 18 2019 00:00:00 GMT-0600 (Mountain Daylight Time),Russian Man Casts 90% Video Discount Spell On Big Man Tyrone!,474,2,352,3401,6We7z1bSGbY,,35.19522987
"Minecraft, 2b2t, Faction, Anarchy",Big Man Tyrone,Wed Apr 03 2019 00:00:00 GMT-0600 (Mountain Daylight Time),Tyrone Joins A Minecraft Faction On 2b2t,1183,17,75,16106,xmYRvzaIq5Y,,41.92593185
"kekistan, kekistani, proud kekistani, professional videos, birthday videos, video jokes, Big Tyrone, personal video, corporate video, video production, product video marketing, video, marketing videos, product marketing, rapid growth coach, pepe, shadilay, Big Man Tyrone, sargon of akkad, trump, pol, cosplay, anime, meme, memes, frog, dank meme compilation, try not to laugh, tyrone, dank, congratulations",Big Man Tyrone,Mon Apr 01 2019 00:00:00 GMT-0600 (Mountain Daylight Time),Big Man Tyrone Resigns As Kekistan President After Death Threats,16174,120,267,138426,sfMPDjtQADQ,,51.23626626
"kekistan, kekistani, proud kekistani, professional videos, birthday videos, video jokes, Big Tyrone, personal video, corporate video, video production, product video marketing, video, marketing videos, product marketing, rapid growth coach, pepe, shadilay, Big Man Tyrone, sargon of akkad, trump, pol, cosplay, anime, meme, memes, frog, dank meme compilation, try not to laugh, tyrone, dank, congratulations",Big Man Tyrone,Mon Apr 01 2019 00:00:00 GMT-0600 (Mountain Daylight Time),Big Man Tyrone Tells April-Born Viewers: Do A Good Deed Every Day,270,1,386,2717,yxzhcLV4Chw,,34.22339655
"whatthewat, kekistan, kekistani, proud kekistani, professional videos, birthday videos, video jokes, Big Tyrone, personal video, corporate video, video production, product video marketing, video, marketing videos, product marketing, rapid growth coach, pepe, shadilay, Big Man Tyrone, sargon of akkad, trump, pol, cosplay, anime, meme, memes, frog, dank meme compilation, try not to laugh, tyrone, dank, congratulations",Big Man Tyrone,Thu Mar 28 2019 00:00:00 GMT-0600 (Mountain Daylight Time),"Hi, I'm WatTheWut",554,5,7,10897,ISe0KWhdWgw,,40.23493016
"kekistan, kekistani, proud kekistani, professional videos, birthday videos, video jokes, Big Tyrone, personal video, corporate video, video production, product video marketing, video, marketing videos, product marketing, rapid growth coach, pepe, shadilay, Big Man Tyrone, sargon of akkad, trump, pol, cosplay, anime, meme, memes, frog, dank meme compilation, try not to laugh, tyrone, dank, congratulations",Big Man Tyrone,Fri Mar 22 2019 00:00:00 GMT-0600 (Mountain Daylight Time),Get A Full Big Man Tyrone Video For $10 This Weekend  90% Off! (REUPLOAD),200,2,293,3571,wmz5T6WH0q0,,35.40633726
"Burgerkrieg, TheBurgerkrieg, Big Asparagus",Big Man Tyrone,Fri Mar 15 2019 00:00:00 GMT-0600 (Mountain Daylight Time),Attention All Humans!,717,6,35,9577,3s0AIqhMPXs,,39.67607426
"kekistan, kekistani, proud kekistani, professional videos, birthday videos, video jokes, Big Tyrone, personal video, corporate video, video production, product video marketing, video, marketing videos, product marketing, rapid growth coach, pepe, shadilay, Big Man Tyrone, sargon of akkad, trump, pol, cosplay, anime, meme, memes, frog, dank meme compilation, try not to laugh, tyrone, dank, congratulations, syria, venezuela",Big Man Tyrone,Fri Mar 15 2019 00:00:00 GMT-0600 (Mountain Daylight Time),"Normies, Hands off Venezuela and Syria!",841,54,50,10548,0UrMlEgxl-o,,40.09404557
"kekistan, kekistani, proud kekistani, professional videos, birthday videos, video jokes, Big Tyrone, personal video, corporate video, video production, product video marketing, video, marketing videos, product marketing, rapid growth coach, pepe, shadilay, Big Man Tyrone, sargon of akkad, trump, pol, cosplay, anime, meme, memes, frog, dank meme compilation, try not to laugh, tyrone, dank, congratulations, kekistan tees",Big Man Tyrone,Tue Mar 12 2019 00:00:00 GMT-0600 (Mountain Daylight Time),Richard Says Larissa Is So Beautiful And Precious To Him,424,2,44,3107,GKlpDOgd-6w,,34.80391958
"cat, wild, adventure, adventurous, animals, breaking trail, coyote, coyote peterson, peterson, snapping turtle, trail, wildife, cat attacks, cats attack, tiger attack, ocelot, jungle cat, lion, lion king, lion roar, lion king movie, lion adventure, safari, lion attack, big cats, south africa, kruger national park, cats, king of the jungle, lion safari, lion whisperer, bite of the king, lion bite, bite of the lion, lion teeth, lion fangs, would you hold paws with a lion?!, paw, paws",Brave Wilderness,Fri Apr 19 2019 00:00:00 GMT-0600 (Mountain Daylight Time),Would You Hold PAWS with a LION?!,12279,588,1328,316623,XFeItKoT0Fw,,69.95040196
"monkey attack, attacked by monkeys, cat, wild, adventure, adventurous, animals, breaking trail, coyote, coyote peterson, peterson, snapping turtle, trail, cats, Wild cat, predator cat, wildife, angry cat, animals attack, ocelot, jungle cat, cat like, monkey, kinkajou, honeybear, honey bear, bear, exotic, kinkajou pet, bizarre creature, funny animal, too cute, cute animals, cute animal videos, cutest animals, kittens, cute, monkeys, ferociously adorable kinkajou, ferocious, ferociously, adorable",Brave Wilderness,Sun Apr 14 2019 00:00:00 GMT-0600 (Mountain Daylight Time),FEROCIOUSLY ADORABLE Kinkajou!,5616,140,620,161360,7X-BznlPHAc,,63.62044218
"adventure, adventurous, animals, breaking, breaking trail, coyote, coyote peterson, peterson, trail, wild, collared lizard, lizard, reptile, desert lizard, desert reptiles, eastern collared lizard, common collared lizard, desert, whipsnake, snake, cacti, Desert WIldlife, arizona lizard, kid show, family friendly, adventure show, bitten, catching collard lizards, animal bite, lizard bite, bitten by a lizard, collar lizard, fastest lizard, wildlife, fastest lizard is quick to bite!, quick, bite",Brave Wilderness,Fri Apr 12 2019 00:00:00 GMT-0600 (Mountain Daylight Time),FASTEST LIZARD is Quick to BITE!,10441,304,605,391086,DBILPTBuJeA,,70.99376762
