"scp, scp wiki, annapantsu, comedy, animation, confinement, lord bung, music parody, entertainment, music, secure contain protect, secure, contain, protect, horror, bung, parody, cartoon, lord, monster, corn, fine, dandy, connor, containment",Lord Bung,Sun Mar 03 2019 00:00:00 GMT-0700 (Mountain Standard Time),SCP Confinement Music Video: Fine & Dandy,68661,909,225,1839522,sxLSAGAFPLI,,85.75705968
,Lord Bung,Mon Jan 28 2019 00:00:00 GMT-0700 (Mountain Standard Time),Confinement Update: I broke my bum,35147,90,75,407039,CN_A8EMVx0A,,72.56818907
"SCP, SCP wiki, animation, comedy, horror, dark comedy, lord bung",Lord Bung,Fri Dec 14 2018 00:00:00 GMT-0700 (Mountain Standard Time),Confinement Ep6: The Infinite IKEA (part 1 of 2),126216,688,671,2248096,Vcq1lLCgk7E,,88.71584228
"SCP wiki, SCP foundation, SCP, Lord Bung, Confinement, animation, behind the scenes, comedy, horror, Qu0026A",Lord Bung,Fri Sep 14 2018 00:00:00 GMT-0600 (Mountain Daylight Time),Confinement Q&A with Lord Bung: Behind the Scenes,13364,53,408,199911,EZ-dG7M7h4c,,63.20528985
"Confinement, lord bung, SCP, IKEA, infinite IKEA",Lord Bung,Thu Sep 06 2018 00:00:00 GMT-0600 (Mountain Daylight Time),Confinement Ep6 Trailer!,32695,143,31,809761,VN2vQr2ZMk0,,77.84719419
"SCP, SCP wiki, SCP foundation, Animation, Horror, Comedy, Lord Bung",Lord Bung,Mon Jul 23 2018 00:00:00 GMT-0600 (Mountain Daylight Time),Confinement Trailer - An SCP Animated Series,22592,91,57,460974,fkD3u6typrs,,77.23518958
"SCP foundation, Lord Bung, Gemodawn, Romance, Comedy, Animation",Lord Bung,Wed Jun 20 2018 00:00:00 GMT-0600 (Mountain Daylight Time),Confinement Special - Only Us,75853,400,474,1876061,oxaAvfXZhzM,,83.65100828
"pixar cars, history, satire, comedy, mockumentary, lord bung, documentary",Lord Bung,Sat May 12 2018 00:00:00 GMT-0600 (Mountain Daylight Time),THE WORST CAR COLLISIONS IN HISTORY (part 2),7484,98,298,133685,h6-5nonyHSg,,63.34782274
"animation, horror, scp, comedy",Lord Bung,Sun Apr 15 2018 00:00:00 GMT-0600 (Mountain Daylight Time),Confinement Ep5: The Swordsman,105683,575,687,3114331,1NfAvqpt8_w,,90.1629199
"pcie, device, computer, gaming, apex legends, cs:go, csgo, graphics card, gpu, science, STEM, team, cooling, riser, mining",Linus Tech Tips,Mon Apr 15 2019 00:00:00 GMT-0600 (Mountain Daylight Time),The WEIRDEST PC Parts we Found on AliExpress,1349,39,1168,10952,QsdqfcCx5C8,,47.22250448
"Gigabyte, Aero 15, Gaming, Workstation, laptop, RTX, Nvidia, i9",Linus Tech Tips,Sun Apr 14 2019 00:00:00 GMT-0600 (Mountain Daylight Time),A NEW Level of Gimmick? Gigabyte Aero 15 x9 Review,16697,272,625,591936,Jd2GOHfSS5o,,73.26902756
"amd, gaming, system, lan, center, build, pc, intel, 2700x, ryzen, rtx, 2070",Linus Tech Tips,Sat Apr 13 2019 00:00:00 GMT-0600 (Mountain Daylight Time),My DREAM Setup using AMD?? - LMG Lounge Update,23236,509,1029,735632,WoKPCCYvByo,,79.46587414
"Linus, Tech, Tips, Car, Lambo, LTX, LTX2018, automobile, Honda, Civic",Linus Tech Tips,Friday Apr 12 2019 00:00:00 GMT-0600 (Mountain Daylight Time),"Facebook NEVER learns - WAN Show April 12, 2019",4429,433,3455,238555,jcE3NG8Z1Fg,,71.45447613
"Thermal paste, DIY, homemade, make your own, thermal, paste, grease, thermal grease, custom, PC, mod, build, Riley Murdock, Alex Clark, using, toothpaste, vaseline, silicon grease, overclock, overclocked, how to, CPU, cooler",Linus Tech Tips,Thu Apr 11 2019 00:00:00 GMT-0600 (Mountain Daylight Time),Can you make your OWN thermal paste??,29569,1021,1298,750242,9xncum0d4Vk,,81.23771679
"amazon, pc, cheap, gaming, intel, rosewill, amd, radeon, samsung, wd, insignia, gaming PC, budget, how to build, cheapest, option, games, 1080p",Linus Tech Tips,Wed Apr 10 2019 00:00:00 GMT-0600 (Mountain Daylight Time),We Built the CHEAPEST PC on Amazon!,34308,1136,1075,1081019,AkK_n5Q8M38,,80.63055139
"gaming, PC, linux, pop!_os, manjaro, ubuntu, nvidia, amd, intel, stadia, google, steam, lutris, dxvk, starcraft ii, proton, wine, native linux games, tutorial, guide",Linus Tech Tips,Tue Apr 09 2019 00:00:00 GMT-0600 (Mountain Daylight Time),Microsoft Should be VERY Afraid - Noob's Guide to Linux Gaming,59031,1099,884,915422,Co6FePZoNgE,,89.39529263
"xbox, adaptive, controller, pro, one, one x, one s, access, accessibility, abled, disability, impaired, one hand, quad stick, quad joy",Linus Tech Tips,Mon Apr 08 2019 00:00:00 GMT-0600 (Mountain Daylight Time),Is Microsoft… the Good Guy? - Xbox Adaptive Controller,29419,812,776,764595,MwYTLiXI6zY,,84.20369459
"pc, water, cooling, liquid, computer, gaming, overclock, sink, tap, stream",Linus Tech Tips,Sun Apr 07 2019 00:00:00 GMT-0600 (Mountain Daylight Time),PC Cooling with the Kitchen Sink?,35419,982,774,800174,CFXyyJyEtVI,,80.15543605
"monitor, surround, ultra wide, 49, triple, nvidia, gaming, dell, lg, samsung, chg90, 4919dw",Linus Tech Tips,Sat Apr 06 2019 00:00:00 GMT-0600 (Mountain Daylight Time),Get on my level.,42889,2591,782,1149763,n5xvPUobfDA,,82.96940111
"The Great Dying, Permian extinction, Permian mass extinction, dinosaurs, paleontology, prehistoric life, alternatehistoryhub, alternatehistoryhub permian, permian great dying, synapsids, therapsids, rise of the dinosaurs, extinction of dinosaurs, what if dinosaurs never went extinct, dinosaurs alternate history, treytheexplainer, evolution, evolution alternate history, speculative evolution",Alternate History Hub,Sun Apr 14 2019 00:00:00 GMT-0600 (Mountain Daylight Time),The Extinction That Caused The Dinosaurs (And If It Never Happened),9986,100,743,158997,ywzPWhsrM_8,,71.49968661
"AlternateHistoryHub, alternate history, the south's plan to conquer the caribbean, the golden circle, golden circle, south golden circle, golden circle caribbean, world of warships, civil war alternate history, civil war, csa alternate history, latin america history, latin america alternate history, latin america golden circle, alternate history hub golden circle, south plan to conquer caribbean, caribbean history, cuba and usa",Alternate History Hub,Fri Mar 22 2019 00:00:00 GMT-0600 (Mountain Daylight Time),The South's Plan To Conquer the Caribbean (And If It Happened),16019,212,685,353526,nVjLZA6RWjo,,73.80414539
"Woodrow Wilson, Woodrow Wilson cynicalhistorian, cynical historian, alternatehistoryhub, woodrow wilson alternate history, world war 1, WWI, great war, great war alternate history, world war 1 alternate history, american interventionism, wilsonianism, the election that ruined everything, election alternate history, teddy roosevelt history, woodrow wilson history, wilson president, world war 1 history, american intervention, rise of communism wwi, russian revolution wwi",Alternate History Hub,Sun Mar 10 2019 00:00:00 GMT-0700 (Mountain Standard Time),The Election That Ruined Everything (And If It Never Happened),28732,904,1819,600256,hLiI6kXZkZI,,87.41759492
"Civil War, Civil War history, civil war alternate history, alternate history, alternate history hub, alternatehistoryhub civil war, what if the civil war never happened, what if the south never secedded, southern secession, alternate history slavery, slavery in the south, civil war alternate scenario, what if the south won the civil war",Alternate History Hub,Tue Feb 05 2019 00:00:00 GMT-0700 (Mountain Standard Time),What if the Civil War Never Happened?,22020,517,1244,519550,sWr8ikxXg9I,,82.33900407
"Horses, What if horses never existed, horses alternate history, alternatehistoryhub, horses never existed, alternate history, history of cavalry, history of the horse, what if, what if the horse didn't exist?, mongol empire, spread of the mongols, central asia horses, domestication of the horse, horse warfare, warfare history, alternate history hub",Alternate History Hub,Sat Jan 05 2019 00:00:00 GMT-0700 (Mountain Standard Time),What if Horses Never Existed?,17007,292,704,319848,vFF3nRKoLWg,,78.28314558
"Google and China, Google China Program, China internet, NordVPN, VPN China, AlternateHistoryHub, alternate history, Project Dragonfly, China detention camps, Uyghurs, Google censorship, china censorship, google and china censorship, google congress, google dragonfly, china dragonfly, china atrocities, google china, google alternatehistoryhub, chinese government",Alternate History Hub,Thu Dec 13 2018 00:00:00 GMT-0700 (Mountain Standard Time),"Don't Be Evil: A Tale of Google, China and Atrocities",31243,575,534,402510,gcvTeRmFsXE,,85.12065781
"The Atlantropa Articles, atlantropa articles, Rome Never Existed Pt. II, Rome Never Existed, Roman Empire never existed, roman empire, roman empire alternate history, roman empire history, history of roman empire, celts and romans, celtic paganism, paganism, roman empire and christendom, christendom, alternatehistoryhub, alternate history, roman empire pt. II, what if rome never existed pt. II, paganism and christendom",Alternate History Hub,Mon Dec 03 2018 00:00:00 GMT-0700 (Mountain Standard Time),What if Rome Never Existed? Part II: The Fate of Christendom,15978,245,995,309192,pBxND8Kix7Y,,77.06806373
"vpn, von client, vpn network, free vpn change id, vpn web browser, AlternateHistoryHub, alternate history, what if rome never existed, roman empire, history of rome, punic wars, carthage empire, carthage, ancient europe history, celtic history, celtic, celts and rome, rome and carthage, rome expansion, history of the roman empire, what if the roman empire never existed alternatehistoryhub, roman empire never existed, roman empire never fell, what if, alternate history hub",Alternate History Hub,Sun Oct 28 2018 00:00:00 GMT-0600 (Mountain Daylight Time),What if the Roman Empire Never Existed?,27053,513,1031,696195,0ImebebQAGs,,82.79686946
"The Atlantropa Articles, AlternateHistoryHub, alternate history, the atlantropa articles alternate history, atlantropa, atlantropa articles, alternate history novel, harry turtledove, alternate history fiction, dystopian novel, science fiction, fiction novel, WWII, WWII book, man in the high castle, alternatehistoryhub man in the high castle",Alternate History Hub,Tue Oct 16 2018 00:00:00 GMT-0600 (Mountain Daylight Time),My New Book Is Officially Out (Plus Other Updates),4525,41,91,71189,Fn1gM9PBLhc,,66.28993992
"The Atlantropa Articles, AlternateHistoryHub the atlantropa articles, atlantropa, atlantropa project, atlantropa articles, alternate history fiction, alternate history book, dystopian fiction, alternatehistoryhub",Alternate History Hub,Sun Oct 07 2018 00:00:00 GMT-0600 (Mountain Daylight Time),I Wrote An Alternate History Novel. What is 'The Atlantropa Articles'?,12713,112,191,171165,7gIjqY7cetw,,69.08665318
"black hole, Katie Bouman",Squirrel Monkey,Sun Apr 14 2019 00:00:00 GMT-0600 (Mountain Daylight Time),The black hole picture in the first half of the 20th century,432,16,153,3368,U3PVOXJF-os,,44.15302927
"PUBG, Player, unknown's, battlegrounds, world wide web, wonders of the world wide web",Squirrel Monkey,Sat Apr 15 2019 00:00:00 GMT-0600 (Mountain Daylight Time),PUBG in 1991,1150,15,235,12665,rTlKbc4NErw,,57.45636424
"Marie Kondo, Konmari, world wide web, Wonders of the world wide web",Squirrel Monkey,Sat March 31 2019 00:00:00 GMT-0600 (Mountain Daylight Time),Tidying up your computer in the '90s: Marie Kondo style,917,7,274,15011,BVpSI-sCs4E,,60.84937022
"8 bit guy, dream computer, david murray, 8-bit guy",Squirrel Monkey,Fri Mar 15 2019 00:00:00 GMT-0600 (Mountain Daylight Time),The 8-Bit Guy's Dream Computer,2359,64,250,35777,Q1JPpi9Wz9E,,69.43065926
"Samsung, Galaxy, Fold, Galaxy Fold. World wide web",Squirrel Monkey,Thu Feb 28 2019 00:00:00 GMT-0700 (Mountain Standard Time),The Samsung Galaxy Fold in the late '90s - Wonders of the World Wide Web,1776,34,179,55141,UllZH-Xeb0k,,69.45515174
"LGR, youtubers, creators, vloggers, vlogger",Squirrel Monkey,Sat Feb 09 2019 00:00:00 GMT-0700 (Mountain Standard Time),The Secrets of LGR,4214,97,337,49366,K3VKN3FaI1Q,,65.22293175
"future, time travel, time traveling, past, 1985, yt:cc=on",Squirrel Monkey,Sat Jan 12 2019 00:00:00 GMT-0700 (Mountain Standard Time),Author who visited the future,1346,16,535,16205,42cAbdLbQ9o,,57.4622292
"pewdiepie, meme, meme review, pewdiepie memes",Squirrel Monkey,Sat Jan 05 2019 00:00:00 GMT-0700 (Mountain Standard Time),Life of PewDiePie,3133,53,213,24409,bT1JXEhggq8,,61.37330586
"Minecraft, 90s, world wide web, Minecraft 3D",Squirrel Monkey,Sun Dec 30 2018 00:00:00 GMT-0700 (Mountain Standard Time),Minecraft in the early Nineties (Minecraft 3D),5242,206,198,109365,s8ElbTrYqZQ,,70.06050428
"Tik Tok, TikTok, world wide web",Squirrel Monkey,Tue Nov 27 2018 00:00:00 GMT-0700 (Mountain Standard Time),Tik Tok in 1988 - Wonders of the World Wide Web,17105,303,203,230520,PaZCs-uUBXk,,74.80042042
"Down the Rabbit Hole, DtRH, TempleOS, Terry A. Davis, Terrence Andrew Davis, LoseThos, Documentary, Schizophrenia, Schizophrenic, OSDev, programming, Operating System, OS, SparrowOS, Kiwi Farms, Something Awful",Fredrick Knudsen,Sat Dec 22 2018 00:00:00 GMT-0700 (Mountain Standard Time),TempleOS | Down the Rabbit Hole,66992,1232,5152,1773622,UCgoxQCf5Jg,,75.65309628
"Fredrik Knudsen, Guru Larry, Larry Bundy Jr., GameLife, Down the Rabbit Hole, DtRH, Andrew Rosenblum, Dan Cohen, Melissa, Game Life, Gaming videos, Alex Lizarbe, Geoff Mendicino, Angry Video Game Nerd, AVGN",Fredrick Knudsen,Sat Oct 06 2018 00:00:00 GMT-0600 (Mountain Daylight Time),GameLife (ft. Guru Larry) | Down the Rabbit Hole,18581,947,1552,567581,c0uWTKomkaY,,80.52716167
"Down the Rabbit Hole, fursuit, ConFurence, Fredrik Knudsen, Burned Fur, Mark Merlino, Rod O'Riley, The Prancing Skiltaire, Cartoon/Fantasy Organization, CFO, Convention, furry, furries, DeviantArt, FurAffinity",Fredrick Knudsen,Mon Aug 13 2018 00:00:00 GMT-0600 (Mountain Daylight Time),Furries | Down the Rabbit Hole,40234,988,2648,1345265,8aF2GxWi7Ag,,74.25532916
"Down the Rabbit Hole, Fredrik Knudsen, Final Fantasy House, Jen, Renee, Cid, Greta, Zach, Timeline, DukeLovesYou, Arcaxon, DtRH, otherkin, soulbonding, soulbonders, Housemate Horror, State College Pennsylvania",Fredrick Knudsen,Sat Jul 14 2018 00:00:00 GMT-0600 (Mountain Daylight Time),A Chronological Retelling of the Final Fantasy House | Down the Rabbit Hole Extra,8498,78,506,232310,vHReSTzYQME,,74.30461871
"Down the Rabbit Hole, DtRH, Fredrik Knudsen, Final Fantasy VII House, Final Fantasy House, otherkin, soulbonders, soulbonding, State College Philadelphia, The Sarah Saga, Housemate Horror",Fredrick Knudsen,Sun Jun 03 2018 00:00:00 GMT-0600 (Mountain Daylight Time),The Final Fantasy House | Down the Rabbit Hole,32935,630,2407,1257841,lFRjrLmc_4c,,93.72797314
"Noah Antwiler, The Spoony One, Channel Awesome, That Guy with the Glasses, Angry Video Game Nerd, AVGN, Spoony, LordKat, reviewer, Spoony Bard, dtrh",Fredrick Knudsen,Fri Mar 30 2018 00:00:00 GMT-0600 (Mountain Daylight Time),Noah Antwiler (Spoony) | Down the Rabbit Hole,36602,915,2272,1656083,OMSZ1TqgOIU,,90.60132049
"Down the Rabbit Hole, Mistakes, dtrh",Fredrick Knudsen,Thu Feb 01 2018 00:00:00 GMT-0700 (Mountain Standard Time),Mistakes 2 | Down the Rabbit Hole,6179,179,375,239219,S6oUCN1LWF0,,62.60391736
"Down the Rabbit Hole, Rajneeshpuram, Osho, Ma Anand Sheela, salmonella, Fredrik Knudsen, Rajneesh, commune, new age movement, Oregon, dtrh",Fredrick Knudsen,Tue Jan 23 2018 00:00:00 GMT-0700 (Mountain Standard Time),Rajneeshpuram | Down the Rabbit Hole,33922,735,2356,1250197,Gwx9nqknu-c,,74.33185791
"Fredrik Knudsen, Down the Rabbit Hole, Gene Ray, Otis Eugene Ray, Richard Janczarski, internet, meme, Time Cube, cubic, the greatest thinker, the wisest human, timecube.com, MIT, dtrh",Fredrick Knudsen,Thu Nov 30 2017 00:00:00 GMT-0700 (Mountain Standard Time),Time Cube | Down the Rabbit Hole,25460,374,2725,1002524,H7lWCqbgQnU,,89.78443104
"Fredrik Knudsen, Down the Rabbit Hole, Digital Homicide Studios, Jim Sterling, James Stanton, The Romine Brothers, James Romine, Robert Romine, Loot Toot Games, The Slaughtering Grounds, The Jimquisition, Lawsuit, dtrh",Fredrick Knudsen,Fri Oct 27 2017 00:00:00 GMT-0600 (Mountain Daylight Time),Digital Homicide: Finale | Down the Rabbit Hole,17004,192,946,776806,7n9jSxoy5kc,,75.07987931
"Oneyplays, oney, letsplay, videogames, pcgames",OneyPlay,Mon Apr 15 2019 00:00:00 GMT-0600 (Mountain Daylight Time),Oney Plays Kingdom Hearts 2 - EP 53 - Rose Tinted Bully,1226,2,1378,12280,5fpvTXmt0r0,,40.75206882
"Oneyplays, oney, fallout, fallout new vegas, fallout vegas, fallout new vegas pc, fallout oneyplays, fallout oney plays, oney plays fallout new vegas, oney plays new vegas",OneyPlay,Sun Apr 14 2019 00:00:00 GMT-0600 (Mountain Daylight Time),Oney Plays Fallout: New Vegas - Ep 11 - My Stinkle,1797,20,1557,58724,cpojJYYT8gQ,,47.52498786
"Oneyplays, oney, oney plays, oney plays complete, oney plays complete series, oneyplays complete, jak and daxter, jak ps4, jak and daxter collection, jak and daxter funny, jak and daxter oneyplays, jak and daxter lets play, oney plays jak and daxter",OneyPlay,Sat Apr 13 2019 00:00:00 GMT-0600 (Mountain Daylight Time),Oney Plays Jak and Daxter (Complete Series),1113,17,5619,45055,fbIgFtRoC1Y,,46.37819879
"Oneyplays, oney, fallout, fallout new vegas, fallout vegas, fallout new vegas pc, fallout oneyplays, fallout oney plays, oney plays fallout new vegas, oney plays new vegas",OneyPlay,Sat Apr 13 2019 00:00:00 GMT-0600 (Mountain Daylight Time),Oney Plays Fallout: New Vegas - Ep 10 - My New Friend Boone,1918,25,1320,66618,yg-7Acq6QBw,,48.07087327
"Oneyplays, oney, fallout, fallout new vegas, fallout vegas, fallout new vegas pc, fallout oneyplays, fallout oney plays, oney plays fallout new vegas, oney plays new vegas",OneyPlay,Fri Apr 12 2019 00:00:00 GMT-0600 (Mountain Daylight Time),Oney Plays Fallout: New Vegas - Ep 9 - 50/50,2757,20,1513,76440,PQwEuQCYx1Q,,51.66612047
"Oneyplays, oney, letsplay, videogames, pcgames",OneyPlay,Thu Apr 11 2019 00:00:00 GMT-0600 (Mountain Daylight Time),💎 BEHOLD THIS ANNOUNCEMENT 💎,4544,103,62,94896,QNY25QA35Sc,,54.35706647
"Oneyplays, oney, letsplay, videogames, pcgames",OneyPlay,Wed Apr 10 2019 00:00:00 GMT-0600 (Mountain Daylight Time),Oney Plays BeamNG - Ep 3 - Default Italy,3435,30,1524,97153,YGF4EHSoVgE,,54.45880028
"Oneyplays, oney, letsplay, videogames, pcgames",OneyPlay,Tue Apr 09 2019 00:00:00 GMT-0600 (Mountain Daylight Time),Oney Plays BeamNG - Ep 2 - House Call,3439,26,1063,102001,CbTtwzzzz6k,,49.91467131
"Oneyplays, oney, beamng, beamng drive, beamng gameplay, beamng oneyplays, beamng oney plays, beamng let's play, beamng.drive, beamng crashes, beamng pc",OneyPlay,Mon Apr 08 2019 00:00:00 GMT-0600 (Mountain Daylight Time),Oney Plays BeamNG Drive - Ep 1 - Alpha Pursuit,5144,65,1264,149953,QE7K6lOtTFc,,56.33734008
"Oneyplays, oney, fallout, fallout new vegas, fallout vegas, fallout new vegas pc, fallout oneyplays, fallout oney plays, oney plays fallout new vegas, oney plays new vegas",OneyPlay,Sun Apr 07 2019 00:00:00 GMT-0600 (Mountain Daylight Time),Oney Plays Fallout: New Vegas - Ep 8 - Merchants of Death,2521,29,1441,83348,IK1iHj7EoAA,,49.04057988
"Tech Insider, TI, Tech, Science, Innovation, Digital culture, elon musk, boring company, tunnel, futuristic, project, tesla, spacex, commute, las vegas, chicago, ny, transportation",Tech Insider,Sun Apr 14 2019 00:00:00 GMT-0600 (Mountain Daylight Time),What's Going On With The Boring Company | Untangled,1197,129,304,48329,TN3PaMwK9AA,,60.61337314
"Tech Insider, TI, Tech, Science, Innovation, Digital culture, disney plus, disney, walt disney, streaming service, movies, films, hollywood, marvel, pixar, star wars, tech, netflix, hulu",Tech Insider,Thu Apr 11 2019 00:00:00 GMT-0600 (Mountain Daylight Time),Disney+ Streaming Service Details Finally Revealed,2344,75,244,97467,fhahmFpODCA,,76.05211005
"Tech Insider, TI, Tech, Science, Innovation, Digital culture, spacex, rocket, space, elon musk, nasa, falcon heavy",Tech Insider,Thu Apr 11 2019 00:00:00 GMT-0600 (Mountain Daylight Time),Watch SpaceX Launch And Land The World's Most Powerful Rocket,4840,91,193,192545,7u9M0ZvGfP4,,78.27033453
"Tech Insider, TI, Tech, Science, Innovation, Digital culture, space, astronomy, astronomers, black hole, event horizon telescope",Tech Insider,Wed Apr 10 2019 00:00:00 GMT-0600 (Mountain Daylight Time),How Astronomers Took The First Ever Image Of A Black Hole,15821,203,212,655893,qpYcCI9uzKo,,71.34759771
"Tech Insider, TI, Tech, Science, Innovation, Digital culture, prosthetics, 3dprinting, thirdworldcountries, 3d printed limbs, Guillermo Martinez, limbs, arms",Tech Insider,Wed Apr 10 2019 00:00:00 GMT-0600 (Mountain Daylight Time),Meet The 24-Year-Old Whose Prosthetic Limbs Are Changing Lives,2133,16,183,48180,E0dbagxeMT0,,67.42503003
"Tech Insider, TI, Tech, Science, Innovation, Digital culture, netflix, animation, disney, anime, streaming, japan, disneyplus",Tech Insider,Tue Apr 09 2019 00:00:00 GMT-0600 (Mountain Daylight Time),Why Netflix Is Using Anime To Take On Disney,2587,41,296,71647,Y2byvwuD3C4,,67.76415089
"Tech Insider, TI, Tech, Science, Innovation, Digital culture, facial recognition, data, software, US, china, ICE, immigration, society, privacy",Tech Insider,Sun Apr 07 2019 00:00:00 GMT-0600 (Mountain Daylight Time),Why Facial Recognition Is So Creepy | Untangled,2013,96,452,72532,BqQT4sIOYA0,,68.32705989
"Tech Insider, TI, Tech, Science, Innovation, Digital culture, nasa, astronaut, space, mount everest, career, scott parazynski, space shuttle, spacewalk, drones, flight, CEO, start up, maurizio cheli",Tech Insider,Mon Apr 01 2019 00:00:00 GMT-0600 (Mountain Daylight Time),Meet The Only NASA Astronaut To Climb Mount Everest,1219,38,233,51698,Xq-NLk3AE-w,,71.46818333
"Tech Insider, TI, Tech, Science, Innovation, Digital culture, laptop, touch screen, microsoft, google, device, computers, hardware, software",Tech Insider,Sun Mar 31 2019 00:00:00 GMT-0600 (Mountain Daylight Time),Everything Wrong With Touch Screen Laptops | Untangled,1847,386,251,108881,2UvnyXqB7cM,,61.29849724
"Tech Insider, TI, Tech, Science, Innovation, Digital culture, astronaut, nasa, spacesuit, moon, space, sun, radiation, rescue, spacewalk, moonwalk",Tech Insider,Fri Mar 29 2019 00:00:00 GMT-0600 (Mountain Daylight Time),Why Are NASA Spacesuits White?,2784,92,220,122539,damoYDG9rmk,,71.67469843
"Flamingosis, beats, future funk, instrumental, Hip-Hop, Bright Moments, Vinyl, Records, Full Album, Funk, Soul, Electronic",ElFamosoDemon,Thu Mar 14 2019 00:00:00 GMT-0600 (Mountain Daylight Time),Flamingosis - Bright Moments (Full Album Vinyl),433,2,3051,6044,8BUQPaDbTHs,,59.80898213
"EeMu, beats, instrumental hip hop, electronic, hip hop music, music video, animation, cat and mouse, Fantasy, animals, Cold, Japan, producer, psychedelic",ElFamosoDemon,Wed Feb 27 2019 00:00:00 GMT-0700 (Mountain Standard Time),EeMu - cold,843,6,175,15258,yielghmFpNY,,58.16739403
"kick a dope verse!, beats, instrumental hip hop, Boom bap, sports, 1994, 94, 90s, Football, basketball, montage, Seize, check the formula, Cowboys, San Francisco 49ers, NBA, NFL, Vintage, Chicago Bulls",ElFamosoDemon,Thu Feb 14 2019 00:00:00 GMT-0700 (Mountain Standard Time),seize - check the formula,544,7,133,8324,SALqSTyPshg,,54.69754385
"Beats, compilation, mix, chill, lo fi beats, instrumental hip hop, waves, boom bab, Hip Hop Music, playlist, Showcase, producers, future funk, Water Reflection Effect, sleep, vibes",ElFamosoDemon,Tue Jan 29 2019 00:00:00 GMT-0700 (Mountain Standard Time),Catnap Mix,417,2,1144,7553,bN3-WcP8ldM,,54.15827722
"eggglub, beats, hip hop, instrumental hip hop, Chile, Golf, animation, fashion, Rbnscrsoe, Flakodiablo, loops, Funk, 90's",ElFamosoDemon,Fri Jan 25 2019 00:00:00 GMT-0700 (Mountain Standard Time),Eggglub - Rbnscrsoe,885,8,185,17232,uoCXbKGBy6w,,59.48307011
"Batbxy, beats, all in all, instrumental hip hop, boxing, Tyson, lo fi hip hop, boom bap, Jazz, loops, music video",ElFamosoDemon,Thu Jan 17 2019 00:00:00 GMT-0700 (Mountain Standard Time),BATBXY - all in all.,748,11,111,12565,9urrQSAV7xE,,59.42084283
"Dokutā Slump, Eternal Cruise, beats, future funk, vaporwave, tropical, Chill, Fairies, CRT, monitor, Loops",ElFamosoDemon,Wed Jan 09 2019 00:00:00 GMT-0700 (Mountain Standard Time),Dokutā Slump - Eternal Cruise,345,17,178,7055,07LepUdQvRc,,52.92723409
"Cody G, With You, beats, instrumental Hip Hop, Lo-Fi, Brother, Sister, Diary, Chase, House, Art, Flowers",ElFamosoDemon,Wed Jan 02 2019 00:00:00 GMT-0700 (Mountain Standard Time),Cody G - With You,720,10,192,13152,kT1UvzmgIcU,,57.80387125
"Toetensen, beats, instrumental hip hop, Suburban Blight, Cassette, Beat Tape, Funk, easy listening, Germany, Producer, Loops, Records, Tape Deck, Lo-Fi, Disco",ElFamosoDemon,Tue Jan 01 2019 00:00:00 GMT-0700 (Mountain Standard Time),Toetensen - Suburban Blight [Full BeatTape],234,2,1922,4174,N4PlouclYDQ,,52.55720394
"Loka!, beats, instrumental hip hop, Lo-Fi, Hip Hop music, Think on, Lose, Earwax Daydream, Fuzzoscope, beat tape",ElFamosoDemon,Wed Dec 19 2018 00:00:00 GMT-0700 (Mountain Standard Time),L o k a ! - Think On//Lose,522,9,79,10449,gsc1uNQ7rC0,,55.18641413
"weed, Lebanon, hash, cannabis, Arab World, Legalization, Bekaa Valley, hash oil, cannabis bill, cannabis farmers, cannabis farming, hash production, Legalizing Weed, vice, journalism, documentary, videos, culture, interview, film, movies, underground, vice videos, lifestyle, independent, vice guide, exclusive, vice mag, vice magazine, vice.com, world, documentaries, short films, docs, yt:cc=on, hashish, weedweek2019, weed week, weedweek, history, Yammouneh, legalize, pot, medical marijuana, medicine",Vice,Mon Apr 15 2019 00:00:00 GMT-0600 (Mountain Daylight Time),Lebanon’s Green Gold: The Debate to Legalize Cannabis,918,22,779,8451,KMSyYs5lJlU,,57.46029242
