"Achievement Hunter, AH, video game, gaming, game, gameplay, game play, Geoff Ramsey, Michael Jones, Ryan Haywood, Trevor Collins, Jeremy Dooley, Matt Bragg, Jack Pattillo, Fiona Nova, Larry Matovina, one night ultimate, super villains, werewolf, social deception, heroes, villains, expansion, one night collection 5",Achievement Hunter,Apr 10 2019,SUPER DECEPTION - One Night Ultimate Super Villains - Let's Roll,432,32,1864,3341,MN-JhKHx4Ro,,35.1181928
"Achievement Hunter, AH, video game, gaming, game, gameplay, game play, Gavin Free, Michael Jones, Jack Pattillo, Matt Bragg, Larry Matovina, Yoshi, World, Crafted, Yoshi's, Super Mario, Platformer, Creative, Coop, Cooperative, Shy Guy, Red Coins, Blue, Yellow Coin, Kamek, Baby Bowser, Bowser Jr., Underwater Level, Egg, Throw, Foreground, Background, Collectible",Achievement Hunter,Apr 09 2019,STOP EATING ME - Play Pals - Yoshi's Crafted World,3163,56,1458,112336,zLa1whIunmU,,58.08726994
"Achievement Hunter, AH, video game, gaming, game, gameplay, game play, Gavin Free, Michael Jones, Jack Pattillo, Jeremy Dooley, Matt Bragg, Alfredo Diaz, Andy, Andrew Blanchard, boxes, opening, fan mail, packages, gifts, mardis gras, king cake, expired, perishable, rotten, baby, bubble wrap, knife, sword, card, joker, bunny, hat, south korea, toy, ears, floppy, pump, squeeze, beads, giant uno",Achievement Hunter,Apr 08 2019,Wrapping Our Friend in Bubble Wrap,5208,110,839,186196,RnUNye7L9e8,,63.27427517
"Achievement Hunter, AH, video game, gaming, game, gameplay, game play, always open, white walkers, fruit ninja, jedi, pregnancy, kids, having kids, being a parent, foster kittens, maisie williams, lyft, uber, ebus, 6th street, swords, favor, bathroom fears, making friends, food, mcdonalds, meltdowns, barbara dunkelman, mariel salcedo, lindsay jones, chris demarais, texas de la rosa, hannah mccarthy, sarah weems",Achievement Hunter,Apr 07 2019,Time For Plan B - Off Topic #175,4365,656,8017,161110,B6BQxbw6QuI,,63.31512432
"Achievement Hunter, AH, video game, gaming, game, gameplay, game play, Ryan Haywood, Geoff Ramsey, Gavin Free, Michael Jones, Jack Pattillo, Jeremy Dooley, Trevor Collins, Matt Bragg, Lindsay Jones, Alfredo Diaz, GTA V, Minecraft, Games, Funny Moments, Chaotic moments, Silly",Achievement Hunter,Apr 05 2019,Best of Achievement Hunter - March 2019,4299,71,1947,231447,uMQziBJfSNA,,58.21585451
"Achievement Hunter, AH, video game, gaming, game, gameplay, game play, Alfredo Diaz, Gavin Free, Geoff Ramsey, Jack Patillo, Jeremy Dooley, Matt Bragg, Trevor Collins, moonball, moon ball, stealth ball, throw, dark, infrared, flinchless, paint",Achievement Hunter,Apr 04 2019,THROWING MOON BALLS IN THE DARK - Between the Games,17289,82,336,298988,0YMssG0D9DY,,76.77182248
"Achievement Hunter, AH, video game, gaming, game, gameplay, game play, Alfredo Diaz, Fiona Nova, Geoff Ramsey, Jeremy Dooley, Jack Pattillo, Trevor Collins, Larry Matovina, Coup, Coup Reformation, expansion, how to play, rules, board game, tabletop, table top, card game, secret, betray, betrayal, deception, secret role, social deception, party, duke, duke tax, knowledge is power, inquisitor, assassin, contessa, captain, six player",Achievement Hunter,Apr 03 2019,KNOWLEDGE IS POWER - Coup: Reformation - Let's Roll,4541,193,3011,164619,eW8ccRWGdIk,,57.986314
"Achievement Hunter, AH, video game, gaming, game, gameplay, game play, Michael Jones, Gavin Free, Pikuniku, Steam, platformer, pill, angry, levels, Japanese, car, tethered, coop, puzzle game",Achievement Hunter,Apr 02 2019,ANGRY LITTLE PILL BOYS - Play Pals - Pikuniku,6240,91,2164,228135,ig8zji3HlTc,,58.15347232
"Achievement Hunter, AH, video game, gaming, game, gameplay, game play, Jack Pattillo, Trevor Collins, Matt Bragg, Alfredo Diaz, Fiona Nova, packges, fan mail, boxes, knife, knives, sticky hands, tiny, small, ghost peppers, moonball, box ball, confetti, glitter",Achievement Hunter,Apr 01 2019,"Super Tiny Blade - AHWU for April 1st, 2019 (#467)",3217,113,742,125039,ezxv6LxVWgM,,59.21812063
"Achievement Hunter, AH, video game, gaming, game, gameplay, game play, one night ultimate supervillain, lying, damaged equipment, sarcasm, ah live, achievement haunter, ghosts, ghost hunting, hardcore tabletop, messing with teachers, paranks, brooklyn 99, the orville, jenna elfman, fangirling, dobby, creature, michael jones, jack pattillo, geoff ramsey, alfredo diaz, jeremy dooley, chef mike harris, breakfast, weight loss",Achievement Hunter,Mar 31 2019,Smashing Stuff You Love - Off Topic #174,4156,64,7717,187930,x62lveQXglI,,60.31439509
"fox, super smash bros, smash bros ultimate, alpharad, elite fox, elite smash, game",Alpharad,Apr 05 2019,ELITE FOX: Gun Percent,16600,338,722,494443,IhYW4M2xbA0,,56.74633407
"smash bros ultimate, ultimate, Smash Ultimate CPU Tournament, alpharad, CPU Tournament, game",Alpharad,Apr 03 2019,Smash Ultimate CPU Tournament,22733,355,916,459621,_Clb4Qd7sN8,,70.69491808
"super smash bros, smash bros ultimate, ssb4, bayonetta, super smash bros wii u, wii u, alpharad, smash 4, game",Alpharad,Apr 01 2019,"Funny Smash ""Ultimate"" Video",18158,219,698,518542,ZBk_IWbTIcs,,65.95230396
"super smash bros, smash bros, smash bros ultimate, cpucs, level 9, level 9 cpu, tournament, alpharad, vincent, toyconvict",Alpharad,Mar 31 2019,PUNISHED CONVICT: Ultimate Level 9 CPU Tournament,24098,503,1375,635907,kA2frX-a92Y,,60.83536879
"alpharad, kill la kill, anime, trigger, arcsys, gainax, gurren lagann, ryuko matoi",Alpharad,Mar 27 2019,Kill La Kill IF,18314,315,898,552183,fOcFFfO4-Io,,73.29701685
"super smash bros, smash bros ultimate, alpharad, elite smash, dark pit, items, smash bros, online",Alpharad,Mar 25 2019,ELITE DARK PIT: Carried by Items,16727,207,705,556683,7-SjWyOgVr4,,57.2594895
"super mario odyssey, smo, mario odyssey, super mario, odyssey, nintendo switch, mario, alpharad, speedrun",Alpharad,Mar 21 2019,Perfect Co-op Speedrun in Super Mario Odyssey [15:44] WR,13459,413,944,403629,JeoOdB1i1oA,,58.86801092
"super smash bros, smash bros ultimate, super smash bros ultimate, zelda, alpharad, smash bros, smash bros alpharad, game",Alpharad,Mar 19 2019,ZELDA: The Casual Top Tier,14415,164,732,568612,xDtlTyCQliY,,57.35125506
"super smash bros, smash bros ultimate, smash ultimate, cpucs, level 9 cpu, level 9, ultimate, tournament, alpharad",Alpharad,Mar 17 2019,DARK VINCE AWAKENS: Ultimate Level 9 CPU Tournament,37616,582,1403,887234,MYt7sIQqqqk,,81.29641539
"smash bros, super smash bros, new super mario bros, mario bros, super mario bros, mario, alpharad, nabbit, game",Alpharad,Mar 16 2019,Nabbit's Invincible Revenge,15666,282,852,606786,GFv-1cLSE2U,,57.63248482
"all 7 sins and their power levels explained, all seven sins and their power levels, all 7 sins, every sin, every sin explained, who is the strongest sin?, how strong is meliodas, how strong is ban, how strong is escanor, seven deadly sins, nanatsu no taizai, the seven deadly sins ranked from weakes to strongest, all 7 sins ranked, all 7 sins explained, sds, seven deadly sins power levels, meliodas power level, ban power level, escanor power level, all power levels, animeuproar",AnimeUproar,Apr 10 2019,All 7 Sins and Their Power Levels Explained! (Seven Deadly Sins / Nanatsu no Taizai),934,21,790,7616,YqKMYBrxlGU,,45.65023757
"real, villain, in, black, clover, is, not, who, you, think, black clover, black clover villain, black clover devil, the real villain, the real villain black clover, final villain black clover, new villain black clover, black clover explained, black clover theory, black clover villains, asta, asta demon, asta devil, yami, yuno, elf, licht, hidden evil, black clover secret, asta grimoire, five leaf grimoire, animeuproar, anime uproar, anime, patri, dark elf, asta explained",AnimeUproar,Apr 09 2019,The REAL Villain in Black Clover is NOT who you think!,1185,34,992,21132,wErhoUd86nE,,50.85631259
"every, character's, sin, explained, every character's sin explained, all character sins explained, every sin explained, all 7 sins explained, every sin, seven deadly sins, nanatsu no taizai, meliodas, ban, escanor, king, gowther, diane, merlin, escanor sin of pride, merlin sin of gluttony, how they got their sins, how the seven deadly sins got their sins, meliodas sin of wrath, gowther sin of lust, ban sin of greed, king sin of sloth, diane sin of envy, sds, nnt, animeuproar",AnimeUproar,Apr 05 2019,Every Character's Sin Explained! (Seven Deadly Sins / Nanatsu no Taizai),3274,49,967,95468,l1-vctXL-KU,,60.729508
"is, it, actually, all, over, seven deadly sins, nanatsu no taizai, curse broken, curses broken, is seven deadly sins ending, seven deadly sins end, nanatsu no taizai ending, nanatsu no taizai end, epilogue, epilogue 1, seven deadly sins epilogue, nanatsu no taizai epilogue, seven deadly sins ending, is seven deadly sins over?, meliodas, meliodas demon king, elizabeth curse broken, meliodas curse broken, every sin, every sin explained, animeuproar, every demon, demon clan",AnimeUproar,Apr 03 2019,IS IT ACTUALLY ALL OVER?! (Seven Deadly Sins / Nanatsu no Taizai Manga Epilogue / King Meliodas),3707,67,766,108113,0CqpvqrP680,,62.16654145
"top, 10, overpowered, abilities, in, the, seven, deadly, sins, top 10, top 10 overpowered, strongest abilities, strongest seven deadly sins characters, overpowered seven deadly sins characters, top 10 strongest, who is the strongest sin?, seven deadly sins, nanatsu no taizai, meliodas original power, ban after purgatory, every sin, every sin explained, meliodas, escanor, merlin, animeuproar, demon clan, how strong is meliodas, how strong is escanor, demon king meliodas",AnimeUproar,Apr 02 2019,Top 10 Overpowered Abilities in the Seven Deadly Sins! (Nanatsu no Taizai),2359,34,1121,76013,ZStMAcQwL1o,,56.39676316
"what, if, meliodas, and, elizabeth, had, baby, meliodas elizabeth, meliodas elizabeth baby, meliodas elizabeth child, meliodas elizabeth son, if meliodas and elizabeth had a baby, anime babies, seven deadly sins, nanatsu no taizai, every sin, every sin explained, son of meliodas, son of wrath, son of elizabeth and meliodas, baby of meliodas, baby of elizabeth and meliodas, demon clan, every demon, every demon explained, goddess clan, every goddess, animeuproar, demon king meliodas",AnimeUproar,Apr 01 2019,What if Meliodas and Elizabeth had a BABY?! (Seven Deadly Sins / Nanatsu no Taizai Son of Wrath),3926,68,991,115102,vSx1TQJMq68,,63.6146124
"domestic girlfriend, domestic girlfriend review, domestic na kanojo, domestic na kanojo review, anime review, romance, romance anime, animeuproar, love in anime, domestic girlfriend episode 11, domestic girlfriend episode 12, domestic girlfriend episode 11 review, domestic girlfriend episode 12 review, inuyasha, clannad, clannad afterstory, disney, honey and clover, what is love",AnimeUproar,Mar 30 2019,Domestic Girlfriend and the Beautifully Complicated Nature of Love,792,16,777,10122,vsBtuiJKgHg,,52.65940282
"top 10, overpowered, characters, in, seven, deadly, sins, overpowered characters, seven deadly sins, overpowere characters seven deadly sins, overpowered characters nanatsu no taiza, nanatsu no taizai, top 10 strongest, strongest character seven deadly sins, top 10 strongest seven deadly sins, top 10 strongest nanatsu no taizai, every sin, every sin explained, every demon, every demon explained, demon clan, meliodas, zeldris, ban, king, merlin, escanor, animeuproar",AnimeUproar,Mar 29 2019,Top 10 OVERPOWERED Characters in Seven Deadly Sins! (Nanatsu no Taizai),2635,48,1212,80164,jceKN57Qdlg,,51.87200063
"is, this, the, end, of, seven, deadly, sins, the end, seven deadly sins, the end of the seven deadly sins, the end of nanatsu no taizai, seven deadly sins manga end, nanatsu no taizai manga end, seven deadly sins over, nanatsu no taizai over, when will seven deadly sins end?, when will nanatsu no taizai end?, meliodas, demon king, demon king meliodas, meliodas demon king, sds, nanatsu no taizai, meliodas vs. demon king, meliodas vs demon king, hawk, final battle, animeuproar",AnimeUproar,Mar 27 2019,Is this THE END of the Seven Deadly Sins?! (Nanatsu no Taizai Meliodas vs. Demon King Final Battle),3468,51,666,115554,ZnrS_eOW6pg,,60.42040731
"inside, the, mind, of, demon, king, inside the mind, inside the mind of the demon king, demon king, demon king seven deadly sins, demon king nanatsu no taizai, demon king meliodas, meliodas, meliodas demon king, meliodas father, meliodas demon, seven deadly sins, nanatsu no taizai, seven deadly sins explained, meliodas explained, demon king explained, every demon, every demon explained, every sin, every sin explained, animeuproar",AnimeUproar,Mar 26 2019,Inside the Mind of the Demon King (Seven Deadly Sins / Nanatsu no Taizai),2735,37,960,65048,am0QKSnmm2k,,61.14460351
"instagram, facebook, social media addition, twitter",CaseyNeistat,Apr 01 2019,"MANIPULATED, TRICKED, BRAINWASHED.. moving past a social media addiction",59939,2302,848,1553106,EbR3muQJ66I,,74.87712687
"Mr Beast, money, pewdiepie, goblin, nose, facial",CaseyNeistat,Mar 27 2019,"$2 MILLION in 12 months, the price of Mr. Beast's success",165909,3915,1460,4080773,UE6UkF9sABU,,92.43648021
"instagram, facebook, social media, twitter",CaseyNeistat,Mar 13 2019,Goodbye Social Media.,80953,2517,548,2380369,6DfP10OeDP0,,76.92655627
"what the fit, kevin hart, kevin heart, lifeguard, santa monica, california",CaseyNeistat,Mar 04 2019,im a lifeguard now.,61251,1797,677,1765588,-B4wmuJ-qSs,,81.4833247
"video essay, poor, rich, CaseyNeistat",CaseyNeistat,Feb 26 2019,Being RICH vs Being POOR - a video essay,86795,1861,613,2033238,ROfBLx6bLZI,,76.24433786
"superbowl, joe, friends, CaseyNeistat",CaseyNeistat,Feb 07 2019,IT FINALLY HAPPENED!!,58882,1052,774,1331770,60iQSbNkISo,,83.28829809
"One last attempt, CaseyNeistat",CaseyNeistat,Feb 05 2019,ONE LAST ATTEMPT..,44142,729,610,1288375,7yCtB1JYXs0,,80.06831569
"Burger King, Burger King Vs CaseyNeistat, Burger King CaseyNeistat",CaseyNeistat,Feb 02 2019,BURGER KiNG Fights back (this is not an ad),106818,3323,340,2487460,95kffMA2dNA,,87.21837115
"brothers, CaseyNeistat",CaseyNeistat,Feb 01 2019,Bros Tho.,33982,568,493,926229,SEuQAUbgJII,,78.74182247
"Burger King, Burger King Vs CaseyNeistat, Burger King CaseyNeistat",CaseyNeistat,Jan 29 2019,EXPLOITED BY BURGER KING.,135685,7821,438,2754755,yto4a3tdqYc,,77.55877261
"Anime Zone, Gigguk, Top Anime, OP, ED, Anime Endings, Best Anime Endings, Top Anime Endings, Top 10 Anime Endings, Anime Conclusions, Top Anime Conclusions, Top 10 Anime Conclusions, Top Anime ED, Anime ED, anime",Gigguk,Mar 28 2019,The Art of Ending an Anime,53082,427,1010,818375,GMc8icI6mmg,,86.30732106
"Anime Zone, Gigguk, Top Anime, OP, ED, Domestic Girlfriend, Domestic Girlfriend Review, Domestic Girlfriend OP, Domestic Girlfriend ED, Domestic Girlfriend episode 1, Domestic Kanojo, Domestic Kanojo OP, anime",Gigguk,Mar 21 2019,describing domestic girlfriend's spicy plot after eating a ghost pepper,50799,520,451,562952,ZTZ70sS5gd4,,84.0105576
"Anime Zone, Gigguk, Top Anime, OP, ED, Top Romance Anime, Drama Anime, Top Drama Anime, top 10 Romance Anime, Top 10 Drama Anime, Domestic Girlfriend, Domestic Girlfriend OP, DOmestic Girlfriend ED, Domestic Girlfriend Review, Domestic Girlfriend Episode 1, anime",Gigguk,Mar 19 2019,Domestic Girlfriend: A Dumpster Fire I Can't Stop Watching,81063,721,811,1267397,n2OQu9yMh9k,,73.99726349
"Anime Zone, Gigguk, Top Anime, OP, ED, Anime, Anime Mainstream, Anime Rant, Anime Brands, Anime Analysis, Anime Documentary, Anime Global, Anime Popular, Castlevania, High Guardian Spice, Anime Defini, anime",Gigguk,Mar 08 2019,Anime is a Brand,57641,789,757,908825,WWccr1r-H0E,,87.74074089
"Anime Zone, Gigguk, Top Anime, OP, ED, Shield Hero, The Rising of the Shield Hero, Isekai, Shield Isekai, Top Isekai, best Isekai, Top 10 Isekai, Top Isekai 2018, Shield Hero OP, Shield Hero ED, Shield Hero Episode 1, anime",Gigguk,Feb 26 2019,Shield Hero: The Rising of the Isekai Genre,55747,446,733,975705,74jNvMw-FLc,,85.32893987
"Anime Zone, Gigguk, Top Anime, OP, ED, best Girl, Best Girl Anime, Anime, Top Waifu, Top Anime Waifu, Top 10 Anime Waifu, Best Girl Shield Hero, Raphtalia Best girl, Raphtalia, Filo, anime",Gigguk,Feb 19 2019,when you disagree over best girl,65934,564,254,826824,JcZBxdbPjVs,,87.42310955
"Anime Zone, Gigguk, Top Anime, OP, ED, Winter Anime, Winter Anime 2019, 2019 Winter Anime, Top Winter Anime, Best Winter Anime, Winter 2019 Anime Season, Anime 2019, Winter Anime Guide, Winter 2019 Anime Guide, Best Winter OP, Best Winter ED, anime",Gigguk,Feb 07 2019,Winter Anime 2019 in a Nutshell,94648,794,655,1794777,TmY8NG5t-lQ,,91.61077321
"Anime Zone, Gigguk, Top Anime, OP, ED, Best Anime, Best Anime 2018, Top Anime 2018, Best ANime Fights, Best Anime Fights 2018, Top ANime FIghts 2018, Top Anime OP 2018, Best ANime ED 2018, Anime Awards, Crunchyroll ANime Awards, Best Action Anime 2018, Best ANime OST 2018, anime",Gigguk,Jan 24 2019,Best of Anime 2018,68547,1371,1020,1288369,4kSjq35b5K4,,88.73365558
"Anime Zone, Gigguk, Top Anime, OP, ED, Anime in 2018, 2018 Anime, Top Anime 2018, Top 10 Anime 2018, top 10 Anime, Winter 2018 Anime, Spring 2018 Anime, Top Spring 2018 Anime, Best 2018 Anime, anime",Gigguk,Jan 01 2019,Anime in 2018,138239,1460,1303,2064151,OMybzJY5K0Y,,76.10830352
"Anime Zone, Gigguk, Top Anime, OP, ED, That Time I got reincarnated as a slime, Slime Anime, Slime Isekai, Slime Tensei, Top Isekai, Best Isekai, Top 10 Isekai Anime, Top Isekai 2018, TenSura, Tensei shitara Slime Datta Ken, Slime Anime OP, Slime Anime ED, That Time I Got Reincarnated as a Slime OP, Slime Isekai OP, Slime ANime Episode 1, That Time I Got Reincarnated As A Slime ED, anime",Gigguk,Dec 24 2018,Slime Isekai: The Best Kind Of Isekai Anime,63998,730,620,1176005,YsJ4aguEcNk,,87.84542017
"jacksepticeye, Totally Accurate Battle Simulator, Totally Accurate Battle Simulator Gameplay, Totally Accurate Battle Simulator jacksepticeye, Funny, walkthrough, playthrough, army, build your army, physics, funny physics, lets play, let's play, TABS, download link, alpha, war, top down, funny moment, sandbox, biggest battle, last level, hwacha, musket, guns, viking, giant, giants, dark peasant, hilary, trump, All levels complete, neon, neon update, star wars, early access, full game, update",Jacksepticeye,Apr 10 2019,THIS ONE MAN CAN SAVE THE WORLD AND WIN THE WAR | Totally Accurate Battle Simulator #3,11250,74,1530,90384,A7LmoRvqLAA,,57.81340412
"jacksepticeye, HTC Vive, Valve VR, Valve HTC Vive, SteamVR, virtual reality, VR demo, HTC Vive gameplay, reaction, games, VR games, virtual reality games, VR headset, VR gameplay, playthrough, lets play, virtual reality lets play, technology, PC, Playthrough, gameplay, Job Sim, Job Simulator, HTC Vive Jacksepticeye, mods, giant mod, vacation simulator, vacation simulator VR, vacation simulator HTC Vive, vacation sim jacksepticeye, vacation simulator gameplay, jacksepticeye character",Jacksepticeye,Apr 09 2019,I Got To Voice A Character In Vacation Simulator VR!,55485,321,1483,988327,vK-s87BPGW4,,75.92083905
"jacksepticeye, Totally Accurate Battle Simulator, Totally Accurate Battle Simulator Gameplay, Totally Accurate Battle Simulator jacksepticeye, Funny, walkthrough, playthrough, army, build your army, physics, funny physics, lets play, let's play, TABS, download link, alpha, war, top down, funny moment, sandbox, biggest battle, last level, hwacha, musket, guns, viking, giant, giants, dark peasant, hilary, trump, All levels complete, neon, neon update, star wars, early access, full game, update",Jacksepticeye,Apr 08 2019,THAT'S TOTAL BULL | Totally Accurate Battle Simulator #2,52583,403,1313,1121233,XXhZJl_T-NU,,72.28996404
"jacksepticeye, gameplay, 3 games 1 video, funny game, download, download link, indie game, random games, random indie games, random funny games, random jacksepticeye games, scary games, 3 scary games, jumpscare, horror games, indie horror, you're here now, daisy's farm, skelety",Jacksepticeye,Apr 07 2019,People Eat People,66252,503,1471,1057069,vfh8H4LjSq8,,75.29730289
"jacksepticeye, Totally Accurate Battle Simulator, Totally Accurate Battle Simulator Gameplay, Totally Accurate Battle Simulator jacksepticeye, Funny, walkthrough, playthrough, army, build your army, physics, funny physics, lets play, let's play, TABS, download link, alpha, war, top down, funny moment, sandbox, biggest battle, last level, hwacha, musket, guns, viking, giant, giants, dark peasant, hilary, trump, All levels complete, neon, neon update, star wars, early access, full game, update",Jacksepticeye,Apr 06 2019,BREAKING NEWS: THE EARTH IS FLAT | Totally Accurate Battle Simulator #1,68682,785,1237,1419860,YfxCMwxKl6s,,74.48890403
"jacksepticeye, The Walking Dead, season, episode, episodic, telltale, telltale walking dead, a new frontier, the walking dead season 3 episode 1, the walking dead jacksepticeye, full episode, game, videoame, the walking dead game, telltale's the walking dead, clem, clementine, reaction, story, characters, choices, death, dead, character death, zombies, zombie game, PC, XB1, PS4, finale, end, ending, the final season, episode 4",Jacksepticeye,Apr 05 2019,The End Of Clementine,61095,616,6971,1225470,exo7UJFRCBo,,80.51884074
"jacksepticeye, satisfactory, satisfactory game, satisfactory gameplay, Satisfactory walkthrough, Satisfactory playthrough, Satisfactory Jacksepticeye, early access, resource management, gameplay episode, space elevator, automation, automatic, building, survival, space, space game, review, chainsaw, tractor, pee break, jacksepticeye pee break",Jacksepticeye,Apr 04 2019,Don't Edit Out The Pee Break | Satisfactory #7 w/ Robin,31338,262,1984,870642,HsN7ZOvSpcc,,70.61722504
"jacksepticeye, jacksepticeye highlights, jacksepticeye best bits, best of jacksepticeye, jacksepticeye compilation, lets play compilation, best bits compilation, montage, jacksepticeye montage, funny, funny compilation, best of jacksepticeye compilation, highlights, funny moments, best moments, Top of the morning, funniest home videos, just cause, windlands, VR, job simulator, hitman, beat saber, satisfactory",Jacksepticeye,Apr 03 2019,Jacksepticeye Laughing For 12 Minutes Straight,44304,427,715,779880,EjtntWW5Yxc,,72.09697274
"jacksepticeye, satisfactory, satisfactory game, satisfactory gameplay, Satisfactory walkthrough, Satisfactory playthrough, Satisfactory Jacksepticeye, early access, resource management, gameplay episode, space elevator, automation, automatic, building, survival, space, space game, review, chainsaw, tractor",Jacksepticeye,Apr 02 2019,I'M A SUPER SMART BUILDER MAN | Satisfactory #6 w/ Robin,26589,255,2239,803317,qg9BDxSG_K8,,71.10921817
"jacksepticeye, april fools, joke",Jacksepticeye,Apr 01 2019,Jack_Edited.mp4,83409,682,241,872599,6zqd9pRZFB8,,76.13644645
"resident evil 2 rap, resident evil 2 song, resident evil rap, jt music, jtm, jt machinima, jt, resident evil 2, resident evil 2 remake, far from alive, andrea storm kaden, video game music, skull and pat, video game rap, resident evil 7, resident evil 7 rap, jt resident evil, shadow of myself, resident evil song, re7 rap, re2 rap, re2 song, mr x, the tyrant, mr x rap, mr x song, mr x gameplay",JT Music,Apr 06 2019,"MR X RAP by JT Music (Resident Evil 2 Rap) - ""Ready or Not""",9179,173,230,166239,tM6ohsHSNSs,,67.53847307
"sekiro rap, sekiro shadows die twice rap, sekiro song, sekiro shadows die twice song, jt music, jtm, jt machinima, fabvl, sekiro, sekiro shadows die twice, fromsoftware, from software, shadows die twice, dark souls, sekiro shadows die twice ost, sekiro: shadows die twice, sekiro soundtrack, extended sekiro music, relaxing sekiro music, sekiro shadows die twice music, video game music, video game rap, video game, song, rap, soundtrack",JT Music,Mar 30 2019,SEKIRO: SHADOWS DIE TWICE RAP by JT Music & Fabvl,10950,144,264,314201,2oa70yrmeLg,,75.98225231
"Hello neighbor, hello neighbor song, jt, hello and goodbye, hello neighbor rap, hello neighbor jt, tinybuild games, jt music, hello neighbor music video, hello neighbor music, hello neighbor gameplay, hello neighbor walkthrough, rap, jt machinima, skull and pat, pc, skullkruncher13, machinima, skull, pat, video game rap, patfan8326, video game, jtm, jtmusic",JT Music,Mar 23 2019,HELLO NEIGHBOR RAP by JT Music - “Hello and Goodbye” (LIVE ACTION),51352,1246,265,1899436,fJG7JbBBZVo,,83.0319559
"the division 2, jt music, the division 2 rap, the division 2 song, the division, division gameplay, division 2 gameplay, jtm, jt machinima, ubisoft, video game music, video game rap, skull and pat, andrea storm kaden",JT Music,Mar 16 2019,"THE DIVISION 2 RAP by JT Music (feat. Andrea Storm Kaden) - ""Wake Me""",7363,137,258,268511,eCBWeu55jIA,,72.79032107
"metro exodus rap, metro exodus song, metro rap, metro song, metro 2033 song, metro 2033, metro last light, jtm, jt music, jt, jt machinima, video game music, video game rap, skull and pat, andrea storm kaden, video game, metro exodus",JT Music,Mar 09 2019,METRO EXODUS SONG by JT Music (feat. Andrea Storm Kaden),11573,192,273,375125,AGfa24afEBM,,74.57058567
"venom rap, venom song, venom movie, venom, venom tom hardy, tom hardy, venom rap song, jt music, jt machinima, jtm, video game music, marvel comics, spider man, video game rap, skull and pat, venom trailer, eddie brock, venom teaser trailer, we are venom, rap song, no hero, venom rap live, no hero live",JT Music,Mar 02 2019,"Venom Rap LIVE by JT Music - ""No Hero""",7869,101,220,216841,_kl2mdRYyK4,,68.92261666
"anthem rap, anthem song, anthem game, anthem, jt music, jtm, jt machinima, rockit gaming, video game music, skull and pat, anthem gameplay, anthem story, anthem gameplay walkthrough, bioware, freelancers",JT Music,Feb 23 2019,"ANTHEM RAP by JT Music & Rockit Gaming - ""Echoes of the Anthem""",12713,334,314,662236,pO7T6YkIU5g,,81.95993847
